questionid,author,question,options,answer,concept
29250210,李沛恩陳盈靜,"上化學實驗課的時候，老師將班上分為8組，且每組皆安排一位能力較佳的學生，並開始課程任務，雖然課程任務有些難度，但是老師會依據每組的情形去做適當的協助，所以基本上各組皆能完成課程任務。
請問老師將每組皆安排一位能力較佳的學生且老師會依據每組的情形去做適當的協助是依據哪個概念來設計?","1.鷹架構築,    2.合作學習,    3.認知見習,    4.近側發展區,    ",1,鷹架構築
29250301,李沛恩陳盈靜,在西語會話課的時候，老師在一段落結束後停下來讚美同學的發音很正確。用此方法增強同學邁進目標的行為。請問以上敘述為以下何種概念?,"1.後果立即性,    2.消弱,    3.塑造,    4.增強的時制,    ",3,塑造
29250302,李沛恩陳盈靜,根據下圖問題，請問哪一個線段為行為主義中的「消弱陡增」?,"1.線段AB,    2.線段BC,    3.線段CD,    4.線段DE,    ",,
29250303,李沛恩陳盈靜,士奇與龜龜在討論行為主義的概念，請問他們討論的結果何者正確?,"1.撤離型懲罰是喪失某種特權,    2.忽視的行為是無增強,    3.普利馬原則可以強化兒童做不喜歡活動的意願,    4.負增強的目的是在弱化行為,    ",1,正增強、負增強、呈現型懲罰、撤離型懲罰
29250304,李沛恩陳盈靜,「教導一個新技能或新行為時，只要學生更接近終點行為，就給予增強，直到最後學會了一個新技能或新行為。」請問上述說明是指行為主義的何種概念?,"1.後果的立即性,    2.塑造,    3.削弱,    4.維持,    ",2,
29250305,李沛恩陳盈靜,A餐飲公司每二個月就要進行工作內容考試，店長說每位員工都必須記熟工作內容及術語，但他會使用抽籤的方式來隨機抽人來考試。請問上述做法屬於增強的時制的哪一種?,"1.固定比例,    2.不定比例,    3.固定時距,    4.不定時距,    ",3,固定比例、不定比例、固定時距、不定時距
29250306,李沛恩陳盈靜,「丁丁很愛唱歌，認為音樂是他生命的一部分。有天他看到歌唱比賽第一名有100萬的獎金決定去報名，就算沒有得名他也不會放棄繼續唱歌。」關於上述內容何人說的錯誤?,"1.迪西:此過程是一種弱化行為。,    2.拉拉:唱歌對丁丁來說是內在增強物。,    3.小波:為了獎金而去參加比賽，而獎金是外在增強物。,    4.嬰兒太陽:如果就算沒有得名，只要唱歌就有獎金，外在增強物會降低內在增強物。,    ",0,超過一個答案
29250307,李沛恩陳盈靜,多多看到紅色的按鈕，忍不住去按，結果不小心被電到了，他發誓他不會在按第二次了。請問下列選項何者有誤?,"1.多多以後不敢再按紅色按鈕是因為後果改變行為,    2.此歷程是古典制約,    3.此歷程為操作制約,    4.行為跟後果的連接是增強機制,    ",0,超過一個答案
29250308,李沛恩陳盈靜,"老師為了提高同學們的讀書風氣，於是訂定了以下的獎懲條例: 
甲:凡考試80分以上的同學可以獲得飲料一杯 
乙:維持一星期都沒遲到的學生可以不用做值日生乙次 
丙:無故缺曠課者需抄課文3遍 
請問，下列配對何者正確?","1.甲-負增強，乙-正增強,    2.乙-普力馬原則，丙-呈現型懲罰,    3.甲-正增強，丙-撤離型懲罰,    4.乙-負增強，丙-呈現型懲罰,    ",4,正增強、負增強、呈現型懲罰、撤離型懲罰
29250309,李沛恩陳盈靜,阿義因為犯了蓄意縱火罪，法官判阿義「十年有期徒刑，若表現良好可以提早出獄，若試圖逃獄或在監獄鬧事則須加重刑罰延長至20年」。請問「若試圖逃獄或在監獄鬧事則須加重刑罰至20年」是屬於行為主義中的哪個概念?,"1.撤離型懲罰,    2.後果立即性,    3.呈現型懲罰,    4.消弱,    ",1,呈現型懲罰、撤離型懲罰
29250310,李沛恩陳盈靜,小胖從小就喜歡捏黏土，只要有人看到小胖的黏土作品就會誇獎小胖的作品很棒，小胖不斷地磨練自己捏黏土的技巧，最後在一次比賽中獲得冠軍以及眾人的讚揚，讓小胖覺得自己的付出不是徒勞無功。請問小胖之所以會成功是因為以下何種要素?,"1.外在增強物,    2.原級增強物,    3.先行物,    4.負增強,    ",1,外在增強物、原級增強物
29250401,李沛恩陳盈靜,心心開發了一本日常英文會話學習書，而書裡面的主要內容是以聲音搭配文字去作呈現，請問心心開發的此款書籍，是運用了何種理論?,"1.Chunking,    2.雙碼理論,    3.初始記憶,    4.新近效應,    ",2,雙碼理論
29250402,李沛恩陳盈靜,小明考小華有關於行為主義的概念及名詞，小華可以很順利的說出很多概念，請問這是認知心理學何者記憶?,"1.情節性記憶,    2.語意性記憶,    3.程序性記憶,    4.回想性記憶,    ",2,語意記憶、情節記憶、程序性記憶
29250403,李沛恩陳盈靜,丁丁在背單字時，邊看單字的圖像意思邊聽發音，請問此種方式是認知心理學何種理論?,"1.意元集組,    2.雙碼理論,    3.語意性記憶,    4.長期記憶,    ",2,雙碼理論
29250404,李沛恩陳盈靜,小涵在學完英文後，想增進自己的語言能力，於是又學了西班牙文，但是沒想到在學西班牙文的過程中，一直被之前所學的英文影響，導致小涵一直無法把西班牙文學好。請問小涵在這段學習過程中遇到的狀況，是屬於認知心理學的哪個理論?,"1.倒攝抑制,    2.順攝助長,    3.倒攝助長,    4.順攝抑制,    ",4,順攝助長、順攝抑制、倒攝助長、倒攝抑制
29250405,李沛恩陳盈靜,花花在背明天要考的英文單字，結果老師突然把花花叫出去約談，約談完之後，花花忘記了大部分的單字，請問會發生這種情形，是因為花花所背的英文單字無法進入認知歷程的哪一個部分?,"1.短期記憶,    2.感官收錄,    3.工作記憶,    4.長期記憶,    ",4,長期記憶
29250406,李沛恩陳盈靜,安娜在學習游泳時，從一開始要老師扶著身體幫忙，提醒她注意換氣，到現在安娜只要下水就能熟悉方法且自在的游泳。請問上述可以用哪種教育心理學概念來解釋?,"1.Chunking,    2.基模修正,    3.自動化,    4.短期記憶,    ",3,自動化
29250407,李沛恩陳盈靜,老師在課堂要大家背誦出元素週期表，大部分的同學都能輕易背出前面的「氫」、「鋰」、「鈉」、「鉀」、「銣」、「銫」、「砝」、「鈚」、「鎂」、「鈣」、「鍶」、「鋇」、「鐳」，但是之後的元素多數人都支支吾吾的唸，請問這種情況可以用認知心理學的何種理論說明?,"1.機械式學習,    2.初始效應,    3.新近效應,    4.程序性記憶,    ",2,新近效應、初始效應 
29250408,李沛恩陳盈靜,老師教英文單字時，依序教apple、banana、cat、dog。小米回家後發現他對dog的印象較深刻，也最容易記起來。請問這是認知心理學何種概念?,"1.順攝助長,    2.組織化,    3.時近效應,    4.情節性記憶,    ",3,新近效應、初始效應 
29250409,李沛恩陳盈靜,阿家已經有三年沒有騎過腳踏車，但是他現在一坐上腳踏車還是記得如何騎。關於上面敘述，阿家記得如何騎腳踏車是認知心理學的何種概念?,"1.情節性記憶,    2.語意性記憶,    3.程序性記憶,    4.自動性記憶,    ",3,語意記憶、情節記憶、程序性記憶
29250410,李沛恩陳盈靜,天線寶寶們聚集起來討論有關認知心理學的概念，請問下列何人的說法是錯誤的?,"1.丁丁:我能想起我10歲的聖誕節派對是2007年12月25日在草原上。因為我有情節性記憶,    2.拉拉:情節性記憶長期下來會變語意記憶。,    3.迪西:語意性記憶跟程序性記憶都是屬於長期記憶。,    4.小波:跟抽象知識相關的是情節性記憶。,    ",2,語意記憶、情節記憶、程序性記憶
